<?xml version="1.0" encoding="UTF-8"?>
<dataroot xmlns:od="urn:schemas-microsoft-com:officedata" xmlns:xsi="http://www.w3.org/2001/XMLSchema-instance"  xsi:noNamespaceSchemaLocation="Heraldry.xsd" generated="2019-05-23T09:31:35">
<Heraldry>
<ID>45</ID>
<Identifier>LanghamS1</Identifier>
<Shield_x0020_type>plain</Shield_x0020_type>
<Achievement>cardinal&apos;s hat</Achievement>
<Number>2</Number>
</Heraldry>
<Heraldry>
<ID>65</ID>
<Identifier>Puy1</Identifier>
<Shield_x0020_type>plain</Shield_x0020_type>
<Number>2</Number>
</Heraldry>
<Heraldry>
<ID>62</ID>
<Identifier>Pierre2</Identifier>
<Shield_x0020_type>plain</Shield_x0020_type>
<Number>2</Number>
</Heraldry>
<Heraldry>
<ID>72</ID>
<Identifier>Vergne1</Identifier>
<Shield_x0020_type>plain</Shield_x0020_type>
<Number>2</Number>
</Heraldry>
<Heraldry>
<ID>39</ID>
<Identifier>Grimaldi1</Identifier>
<Shield_x0020_type>plain</Shield_x0020_type>
<Number>1</Number>
</Heraldry>
<Heraldry>
<ID>55</ID>
<Identifier>Montalais1</Identifier>
<Shield_x0020_type>plain</Shield_x0020_type>
<Surround>structural</Surround>
<Achievement>cardinal&apos;s hat</Achievement>
<Number>2</Number>
</Heraldry>
<Heraldry>
<ID>63</ID>
<Identifier>PierreCosmedin1</Identifier>
<Shield_x0020_type>plain</Shield_x0020_type>
<Achievement>cardinal&apos;s hat</Achievement>
<Number>1</Number>
</Heraldry>
<Heraldry>
<ID>23</ID>
<Identifier>Chanac1</Identifier>
<Shield_x0020_type>plain</Shield_x0020_type>
<Number>2</Number>
</Heraldry>
<Heraldry>
<ID>70</ID>
<Identifier>Sortenac1</Identifier>
<Shield_x0020_type>plain</Shield_x0020_type>
<Number>2</Number>
</Heraldry>
<Heraldry>
<ID>79</ID>
<Identifier>Borsano1</Identifier>
<Shield_x0020_type>plain</Shield_x0020_type>
</Heraldry>
<Heraldry>
<ID>3</ID>
<Identifier>AigrefeuilleG1</Identifier>
<Shield_x0020_type>plain</Shield_x0020_type>
<Number>2</Number>
</Heraldry>
<Heraldry>
<ID>48</ID>
<Identifier>Luna2</Identifier>
<Shield_x0020_type>plain</Shield_x0020_type>
<Number>2</Number>
</Heraldry>
<Heraldry>
<ID>89</ID>
<Identifier>SoderiniF1</Identifier>
<Shield_x0020_type>plain</Shield_x0020_type>
<Surround>cornucopiae</Surround>
<Achievement>cardinal&apos;s hat with looped cords</Achievement>
</Heraldry>
<Heraldry>
<ID>83</ID>
<Identifier>LangM1</Identifier>
<Shield_x0020_type>plain</Shield_x0020_type>
<Achievement>cardinal&apos;s hat with looped cords</Achievement>
<Insignia>cross-staff</Insignia>
</Heraldry>
<Heraldry>
<ID>50</ID>
<Identifier>Malesset1</Identifier>
<Shield_x0020_type>plain</Shield_x0020_type>
<Achievement>cardinal&apos;s hat</Achievement>
<Number>2</Number>
</Heraldry>
<Heraldry>
<ID>12</ID>
<Identifier>BoulogneG1</Identifier>
<Shield_x0020_type>plain</Shield_x0020_type>
<Number>2</Number>
</Heraldry>
<Heraldry>
<ID>40</ID>
<Identifier>Gros1</Identifier>
<Shield_x0020_type>plain</Shield_x0020_type>
<Achievement>cardinal&apos;s hat with straight cords</Achievement>
<Number>2</Number>
</Heraldry>
<Heraldry>
<ID>81</ID>
<Identifier>CorsiniP1</Identifier>
<Shield_x0020_type>plain</Shield_x0020_type>
<Achievement>cardinal&apos;s hat</Achievement>
</Heraldry>
<Heraldry>
<ID>5</ID>
<Identifier>Amboise1</Identifier>
<Category>ecclesiastical and personal</Category>
<Shield_x0020_type>plain</Shield_x0020_type>
<Achievement>cardinal&apos;s hat with straight cords</Achievement>
<Number>2</Number>
<Insignia>cross-staff</Insignia>
</Heraldry>
<Heraldry>
<ID>16</ID>
<Identifier>KempJ1</Identifier>
<Category>ecclesiastical and personal</Category>
<Shield_x0020_type>plain</Shield_x0020_type>
<Number>2</Number>
</Heraldry>
<Heraldry>
<ID>27</ID>
<Identifier>Correr1</Identifier>
<Category>ecclesiastical/personal</Category>
<Shield_x0020_type>plain</Shield_x0020_type>
<Achievement>cardinal&apos;s hat</Achievement>
<Number>2</Number>
</Heraldry>
<Heraldry>
<ID>37</ID>
<Identifier>GonzagaF1</Identifier>
<Category>personal</Category>
<Shield_x0020_type>plain</Shield_x0020_type>
<Achievement>cardinal&apos;s hat with looped cords</Achievement>
<Number>1</Number>
</Heraldry>
<Heraldry>
<ID>36</ID>
<Identifier>GonzagaE1</Identifier>
<Category>personal</Category>
<Shield_x0020_type>plain</Shield_x0020_type>
<Surround>decorative corbels</Surround>
<Achievement>cardinal&apos;s hat with looped cords</Achievement>
<Number>1</Number>
</Heraldry>
<Heraldry>
<ID>35</ID>
<Identifier>Givry1</Identifier>
<Category>personal</Category>
<Shield_x0020_type>plain</Shield_x0020_type>
<Achievement>cardinal&apos;s hat with looped cords</Achievement>
<Number>1</Number>
</Heraldry>
<Heraldry>
<ID>44</ID>
<Identifier>Lagier2</Identifier>
<Category>personal</Category>
<Shield_x0020_type>plain</Shield_x0020_type>
<Number>2</Number>
</Heraldry>
<Heraldry>
<ID>43</ID>
<Identifier>Lagier1</Identifier>
<Category>personal</Category>
<Shield_x0020_type>plain</Shield_x0020_type>
<Number>2</Number>
</Heraldry>
<Heraldry>
<ID>42</ID>
<Identifier>Jean1</Identifier>
<Category>personal</Category>
<Shield_x0020_type>plain</Shield_x0020_type>
<Achievement>cardinal&apos;s hat</Achievement>
<Number>2</Number>
</Heraldry>
<Heraldry>
<ID>38</ID>
<Identifier>Grange2</Identifier>
<Category>personal</Category>
<Shield_x0020_type>plain</Shield_x0020_type>
<Achievement>cardinal&apos;s hat with straight cords</Achievement>
<Number>2</Number>
</Heraldry>
<Heraldry>
<ID>28</ID>
<Identifier>EpinayA1</Identifier>
<Category>personal</Category>
<Shield_x0020_type>plain</Shield_x0020_type>
<Achievement>cardinal&apos;s hat with straight cords</Achievement>
<Number>1</Number>
<Insignia>cross-staff</Insignia>
</Heraldry>
<Heraldry>
<ID>15</ID>
<Identifier>CampeggioL1</Identifier>
<Category>personal</Category>
<Shield_x0020_type>plain</Shield_x0020_type>
<Number>1</Number>
</Heraldry>
<Heraldry>
<ID>17</ID>
<Identifier>CapranicaA1</Identifier>
<Category>personal</Category>
<Shield_x0020_type>plain</Shield_x0020_type>
<Achievement>cardinal&apos;s hat with straight cords</Achievement>
<Number>2</Number>
</Heraldry>
<Heraldry>
<ID>19</ID>
<Identifier>Carvajal1</Identifier>
<Category>personal</Category>
<Shield_x0020_type>plain</Shield_x0020_type>
<Achievement>cardinal&apos;s hat with straight cords</Achievement>
<Number>2</Number>
</Heraldry>
<Heraldry>
<ID>20</ID>
<Identifier>CarvajalB1</Identifier>
<Category>personal</Category>
<Shield_x0020_type>plain</Shield_x0020_type>
<Achievement>cardinal&apos;s hat with looped cords</Achievement>
<Number>1</Number>
<Insignia>cross-staff</Insignia>
</Heraldry>
<Heraldry>
<ID>21</ID>
<Identifier>CastiglioneB1</Identifier>
<Category>personal</Category>
<Shield_x0020_type>plain</Shield_x0020_type>
<Achievement>cardinal&apos;s hat with straight cords</Achievement>
<Number>2</Number>
</Heraldry>
<Heraldry>
<ID>11</ID>
<Identifier>Bessarion1</Identifier>
<Category>personal</Category>
<Shield_x0020_type>plain</Shield_x0020_type>
<Achievement>cardinal&apos;s hat</Achievement>
<Number>2</Number>
</Heraldry>
<Heraldry>
<ID>31</ID>
<Identifier>FieschiL1</Identifier>
<Category>personal</Category>
<Shield_x0020_type>plain</Shield_x0020_type>
<Achievement>cardinal&apos;s hat with straight cords</Achievement>
<Number>2</Number>
</Heraldry>
<Heraldry>
<ID>9</ID>
<Identifier>BarL1</Identifier>
<Category>personal</Category>
<Shield_x0020_type>plain</Shield_x0020_type>
<Achievement>cardinal&apos;s hat with straight cords</Achievement>
<Number>2</Number>
</Heraldry>
<Heraldry>
<ID>34</ID>
<Identifier>FonsecaP1</Identifier>
<Category>personal</Category>
<Shield_x0020_type>plain</Shield_x0020_type>
<Achievement>cardinal&apos;s hat with straight cords</Achievement>
<Number>2</Number>
</Heraldry>
<Heraldry>
<ID>29</ID>
<Identifier>EstoutevilleG1</Identifier>
<Category>personal</Category>
<Shield_x0020_type>plain</Shield_x0020_type>
<Achievement>cardinal&apos;s hat with straight cords</Achievement>
<Number>1</Number>
</Heraldry>
<Heraldry>
<ID>53</ID>
<Identifier>MediciG2</Identifier>
<Category>personal</Category>
<Shield_x0020_type>plain</Shield_x0020_type>
<Supports>structural</Supports>
<Achievement>cardinal&apos;s hat with looped cords</Achievement>
<Number>1</Number>
<Insignia>cross-staff</Insignia>
</Heraldry>
<Heraldry>
<ID>30</ID>
<Identifier>EstoutevilleG2</Identifier>
<Category>personal</Category>
<Shield_x0020_type>plain</Shield_x0020_type>
<Achievement>cardinal&apos;s hat with straight cords</Achievement>
<Number>2</Number>
</Heraldry>
<Heraldry>
<ID>1</ID>
<Identifier>Adimarius3</Identifier>
<Category>personal</Category>
<Shield_x0020_type>plain</Shield_x0020_type>
<Achievement>cardinal&apos;s hat</Achievement>
<Number>2</Number>
</Heraldry>
<Heraldry>
<ID>32</ID>
<Identifier>FieschiN1</Identifier>
<Category>personal</Category>
<Shield_x0020_type>plain</Shield_x0020_type>
<Achievement>cardinal&apos;s hat</Achievement>
<Number>1</Number>
</Heraldry>
<Heraldry>
<ID>33</ID>
<Identifier>FoixP2</Identifier>
<Category>personal</Category>
<Shield_x0020_type>plain</Shield_x0020_type>
<Achievement>cardinal&apos;s hat with straight cords</Achievement>
<Number>2</Number>
</Heraldry>
<Heraldry>
<ID>24</ID>
<Identifier>CiboI1</Identifier>
<Category>personal</Category>
<Shield_x0020_type>plain</Shield_x0020_type>
<Supports>profile heads</Supports>
<Surround>profile head</Surround>
<Achievement>cardinal&apos;s hat with looped cords</Achievement>
<Number>1</Number>
</Heraldry>
<Heraldry>
<ID>68</ID>
<Identifier>RovereG2</Identifier>
<Category>personal</Category>
<Shield_x0020_type>plain</Shield_x0020_type>
<Achievement>cardinal&apos;s hat with straight cords</Achievement>
<Number>1</Number>
</Heraldry>
<Heraldry>
<ID>2</ID>
<Identifier>AigrefeuilleF1</Identifier>
<Category>personal</Category>
<Shield_x0020_type>plain</Shield_x0020_type>